{
  "$schema": "https://json-schema.org/draft/2020-12/schema",
  "$id": "https://sigrix.io/schemas/postern/0.1/status.schema.json",
  "title": "Postern status response",
  "description": "Response body of GET /postern/v0/status. Answerable at conformance Level 1 and without credentials. See SPEC.md section 4.4.",
  "type": "object",
  "required": ["postern", "level", "state", "agent", "entitlement"],
  "properties": {
    "postern": { "type": "string", "const": "0.1" },
    "level": {
      "type": "integer",
      "enum": [1, 2, 3],
      "description": "Conformance level. 1 = describe+status, 2 = +run, 3 = +stream."
    },
    "state": { "type": "string", "enum": ["ready", "running", "degraded"] },
    "agent": {
      "type": "object",
      "description": "Which agent this runner serves. SPEC.md section 1.5 says the identifier appears here as well as in describe, and section 2.2's identity rule - one runner, one agent, its port that agent's address - is only checkable when it does. Only id is required: section 4.4's example carries version beside it and nothing obliges it.",
      "required": ["id"],
      "properties": {
        "id": {
          "type": "string",
          "pattern": "^[a-z0-9](?:[a-z0-9.-]*[a-z0-9])?/[a-z0-9](?:[a-z0-9.-]*[a-z0-9])?$",
          "maxLength": 128,
          "description": "Agent identifier (SPEC.md section 1.5). The same string describe reports and the distributor paths address."
        },
        "version": { "type": "string" }
      },
      "additionalProperties": true
    },
    "entitlement": {
      "type": "object",
      "description": "SPEC.md section 5.1 requires a runner with no distributor to report state as not_required, so the block is not omissible: saying nothing is indistinguishable from a runner that has not implemented entitlement at all, which is the one thing a client reads this to find out.",
      "required": ["state"],
      "properties": {
        "state": {
          "type": "string",
          "enum": ["active", "revoked", "unknown", "not_required"],
          "description": "not_required means no distributor is configured; the runner MUST NOT refuse to run on entitlement grounds. unknown means the runner cannot presently vouch: inside a declared grace period, or never having obtained an answer (SPEC.md section 5.7). checked_at tells those two apart."
        },
        "checked_at": {
          "type": "string",
          "format": "date-time",
          "description": "The distributor's own read time, propagated unchanged from the entitlement check. A runner MUST NOT re-stamp it with its own clock. REQUIRED when state is active or revoked. A 404 carries no such value, and there the runner reports its own receipt time instead (SPEC.md section 5.7.4)."
        },
        "stale_after_seconds": {
          "type": "integer",
          "minimum": 0,
          "description": "REQUIRED when state is active or revoked. With grace_seconds it bounds how long a revoked entitlement can keep working; under revoked it is instead when the runner re-checks. After a 404 the runner supplies its own re-check cadence, reusing the distributor's last value where it has one (SPEC.md section 5.7.4)."
        },
        "grace_seconds": {
          "type": "integer",
          "minimum": 0,
          "description": "The grace the distributor declared for an unreachable check (SPEC.md sections 5.3, 5.7), where the runner has been told one. A client needs it beside checked_at to say when an agent running through an outage stops."
        },
        "access_ends_at": {
          "type": "string",
          "format": "date-time",
          "description": "The date the distributor gave for this buyer's access to end (SPEC.md sections 4.4, 5.3), unchanged, where the answer the runner holds gave one. Kept through a grace period, the date being the last thing the distributor said, and absent after a 404, which gives none. A client needs it to warn a buyer before access ends."
        }
      },
      "additionalProperties": true,
      "allOf": [
        {
          "if": {
            "properties": { "state": { "const": "active" } },
            "required": ["state"]
          },
          "then": { "required": ["checked_at", "stale_after_seconds"] }
        },
        {
          "if": {
            "properties": { "state": { "const": "revoked" } },
            "required": ["state"]
          },
          "then": { "required": ["checked_at", "stale_after_seconds"] }
        }
      ]
    },
    "credentials": {
      "type": "object",
      "description": "Which of the environment variables describe declares (SPEC.md section 4.1.3) this deployment actually carries. OPTIONAL, and it belongs here rather than in describe for the reason limits does: which credentials one machine happens to hold is a fact about that deployment, where describe answers for the agent and answers the same everywhere. Publishing this block is a different obligation from performing the check \u2014 section 4.6's step 5 MUSTs every runner to answer 424 where a declared credential is unset, and a runner may perform that check and report no credential state at all.",
      "properties": {
        "satisfied": {
          "type": "boolean",
          "description": "True when every environment variable describe declares is set."
        },
        "missing": {
          "type": "array",
          "items": { "type": "string" },
          "description": "The declared environment variable names this deployment does not carry \u2014 the same names a missing_credential refusal names as error.detail.missing (SPEC.md section 4.6)."
        }
      },
      "additionalProperties": true
    },
    "update": {
      "type": "object",
      "description": "What the runner learned when it asked its distributor whether a newer version of the agent exists (SPEC.md section 4.4). OPTIONAL, and present only where such a check actually ran \u2014 a runner with no version check configured omits it, which is a different fact from a check that ran and found no distributor to ask. How a runner obtains the answer is the distributor's to define; this specification adds no path for it.",
      "required": ["state"],
      "properties": {
        "state": {
          "type": "string",
          "enum": ["not_required", "unreachable", "current", "update_available"],
          "description": "not_required: no distributor is configured, mirroring entitlement's own state (section 5.1). unreachable: one is and could not be asked \u2014 a client reads this as not known, never as out of date, and a runner MUST NOT refuse to start or to run because of it (section 4.4). current / update_available: the check succeeded, and the running version and the reported one are equal or are not."
        },
        "current": {
          "type": "string",
          "description": "The runner's own describe.agent.version. Present whenever it is knowable, unreachable included: a runner always knows what it is running, whatever it could not reach."
        },
        "latest": {
          "type": "string",
          "description": "The version the distributor reported. Present only under current and update_available, those being the only states in which one was obtained."
        }
      },
      "additionalProperties": true,
      "allOf": [
        {
          "if": {
            "properties": {"state": {"const": "not_required"}},
            "required": ["state"]
          },
          "then": {"not": {"required": ["latest"]}}
        },
        {
          "if": {
            "properties": {"state": {"const": "unreachable"}},
            "required": ["state"]
          },
          "then": {"not": {"required": ["latest"]}}
        }
      ]
    },
    "idempotent_retry": {
      "type": "boolean",
      "description": "Whether this runner honours an Idempotency-Key (SPEC.md section 4.2): a request carrying a key it has already answered MUST NOT execute the agent again, and is answered with the result of the first execution. OPTIONAL, and a client reads absent and false identically \u2014 a retry executes again. It sits in status rather than in describe.capabilities because whether a repeat executes the agent twice is a fact about the runner, where capabilities describes the agent; and beside limits rather than inside it because a boolean is not a bound \u2014 limits.idempotency_retention_seconds says how long the promise lasts, this says whether it is made. A Level 1 runner implements no run and SHOULD NOT declare it."
    },
    "limits": {
      "type": "object",
      "description": "Bounds the runner puts on a run in flight (SPEC.md section 4.5). These belong to the deployment rather than to the agent, which is why they sit here and not in describe: two runners serving one agent may answer differently.",
      "properties": {
        "max_run_seconds": {
          "type": "integer",
          "minimum": 1,
          "description": "The longest a run may take before the runner stops it with 504 run_timeout. REQUIRED where the runner imposes a limit at all, absent where it does not. A runner MUST NOT declare a bound longer than the shortest one it can actually enforce."
        },
        "max_output_bytes": {
          "type": "integer",
          "minimum": 1,
          "description": "The largest artifact the runner will return from a bytes output, measured before base64 rather than after. REQUIRED where the runner bounds one at all, absent where it does not (SPEC.md section 4.1.4)."
        },
        "idempotency_retention_seconds": {
          "type": "integer",
          "minimum": 1,
          "description": "How long the runner replays an Idempotency-Key it has already answered (SPEC.md section 4.2). SHOULD be declared by a runner that honours the header and can state a window; a client MUST NOT assume any particular one where none is declared, and a retry arriving after the window has lapsed is answered by a fresh execution rather than refused. This bounds a promise rather than a run, which is what makes it the odd member here."
        },
        "max_concurrent_runs": {
          "type": "integer",
          "minimum": 1,
          "description": "How many runs the runner will have in flight at once; beyond it, run and stream answer 503 unavailable. At least 1 — a runner that will run nothing says so with its level and a 501, which tells a client retrying is pointless, where a 0 here reads as a temporary condition."
        }
      },
      "additionalProperties": true
    }
  },
  "additionalProperties": true
}
