{
  "postern": "0.1",
  "level": 3,
  "state": "degraded",
  "agent": {
    "id": "acme/market-research-crew",
    "version": "1.3.0"
  },
  "entitlement": {
    "state": "revoked",
    "checked_at": "2026-08-15T09:14:02Z",
    "stale_after_seconds": 300
  },
  "credentials": {
    "satisfied": true,
    "missing": []
  }
}
