{
  "postern": "0.1",
  "level": 3,
  "state": "ready",
  "agent": {
    "id": "acme/market-research-crew",
    "version": "1.3.0"
  },
  "entitlement": {
    "state": "active",
    "checked_at": "2026-08-15T09:14:02Z",
    "stale_after_seconds": 60,
    "grace_seconds": 86400
  },
  "credentials": {
    "satisfied": true,
    "missing": []
  },
  "idempotent_retry": true,
  "limits": {
    "max_run_seconds": 900,
    "max_concurrent_runs": 1
  }
}
